
***********************************************************
***********        Alienware M11X R1        ***************
***********************************************************
*** By neranem & cosgriffc: ***

DEVICE ID 187c:0514 on Bus 005 Address 002 =================
 bLength                :   0x12 (18 bytes)
 bDescriptorType        :    0x1 Device
 bcdUSB                 :  0x110 USB 1.1
 bDeviceClass           :    0x0 Specified at interface
 bDeviceSubClass        :    0x0
 bDeviceProtocol        :    0x0
 bMaxPacketSize0        :   0x40 (64 bytes)
 idVendor               : 0x187c
 idProduct              : 0x0514
 bcdDevice              :    0x0 Device 0.0
 iManufacturer          :    0x1 Alienware Gaming
 iProduct               :    0x2 Phantom


***********************************************************
***********         Alienware 13 R1         ***************
***********************************************************
*** By Francesco Rosa ***

Device: ID 187c:0527 Alienware Corporation 
Device Descriptor:
  bLength                18
  bDescriptorType         1
  bcdUSB               0.02
  bDeviceClass            0 (Defined at Interface level)
  bDeviceSubClass         0 
  bDeviceProtocol         0 
  bMaxPacketSize0        64
  idVendor           0x187c Alienware Corporation
  idProduct          0x0527 
  bcdDevice            0.00
  iManufacturer           1 Alienware
  iProduct                2 AW13
  iSerial                 3 13.0
  bNumConfigurations      1
  Configuration Descriptor:
    bLength                 9
    bDescriptorType         2
    wTotalLength           41
    bNumInterfaces          1
    bConfigurationValue     1
    iConfiguration          0 
    bmAttributes         0xe0
      Self Powered
      Remote Wakeup
    MaxPower                0mA
    Interface Descriptor:
      bLength                 9
      bDescriptorType         4
      bInterfaceNumber        0
      bAlternateSetting       0
      bNumEndpoints           1
      bInterfaceClass         3 Human Interface Device
      bInterfaceSubClass      0 No Subclass
      bInterfaceProtocol      0 None
      iInterface              0 
        HID Device Descriptor:
          bLength                 9
          bDescriptorType        33
          bcdHID               1.01
          bCountryCode            0 Not supported
          bNumDescriptors         1
          bDescriptorType        34 Report
          wDescriptorLength      56
         Report Descriptors: 
           ** UNAVAILABLE **
      Endpoint Descriptor:
        bLength                 7
        bDescriptorType         5
        bEndpointAddress     0x81  EP 1 IN
        bmAttributes            3
          Transfer Type            Interrupt
          Synch Type               None
          Usage Type               Data
        wMaxPacketSize     0x000a  1x 10 bytes
        bInterval              10
Device Status:     0x0000
  (Bus Powered)

***********************************************************
***********         Alienware 13 R3         ***************
***********************************************************
*** By KickinWingAnimalDoctor ***


Device: ID 187c:0529 Alienware Corporation 
Device Descriptor:
  bLength                18
  bDescriptorType         1
  bcdUSB               0.02
  bDeviceClass            0 (Defined at Interface level)
  bDeviceSubClass         0 
  bDeviceProtocol         0 
  bMaxPacketSize0        64
  idVendor           0x187c Alienware Corporation
  idProduct          0x0529 
  bcdDevice            0.00
  iManufacturer           1 Alienware
  iProduct                2 AW13
  iSerial                 3 03.00
  bNumConfigurations      1
  Configuration Descriptor:
    bLength                 9
    bDescriptorType         2
    wTotalLength           41
    bNumInterfaces          1
    bConfigurationValue     1
    iConfiguration          0 
    bmAttributes         0xe0
      Self Powered
      Remote Wakeup
    MaxPower                0mA
    Interface Descriptor:
      bLength                 9
      bDescriptorType         4
      bInterfaceNumber        0
      bAlternateSetting       0
      bNumEndpoints           1
      bInterfaceClass         3 Human Interface Device
      bInterfaceSubClass      0 No Subclass
      bInterfaceProtocol      0 None
      iInterface              0 
        HID Device Descriptor:
          bLength                 9
          bDescriptorType        33
          bcdHID               1.01
          bCountryCode            0 Not supported
          bNumDescriptors         1
          bDescriptorType        34 Report
          wDescriptorLength      56
          Report Descriptor: (length is 56)
            Item(Global): Usage Page, data= [ 0x00 0xff ] 65280
                            (null)
            Item(Local ): Usage, data= [ 0x01 ] 1
                            (null)
            Item(Main  ): Collection, data= [ 0x01 ] 1
                            Application
            Item(Global): Usage Page, data= [ 0x0c ] 12
                            Consumer
            Item(Local ): Usage, data= [ 0x06 ] 6
                            (null)
            Item(Main  ): Collection, data= [ 0x02 ] 2
                            Logical
            Item(Local ): Usage Minimum, data= [ 0x00 ] 0
                            Unassigned
            Item(Local ): Usage Maximum, data= [ 0x66 ] 102
                            Still
            Item(Global): Logical Minimum, data= [ 0x00 ] 0
            Item(Global): Logical Maximum, data= [ 0x01 ] 1
            Item(Global): Report ID, data= [ 0x01 ] 1
            Item(Global): Report Size, data= [ 0x08 ] 8
            Item(Global): Report Count, data= [ 0x0b ] 11
            Item(Main  ): Input, data= [ 0x02 ] 2
                            Data Variable Absolute No_Wrap Linear
                            Preferred_State No_Null_Position Non_Volatile Bitfield
            Item(Main  ): End Collection, data=none
            Item(Global): Usage Page, data= [ 0x14 ] 20
                            Alphanumeric Display
            Item(Local ): Usage, data= [ 0x2b ] 43
                            Character Report
            Item(Main  ): Collection, data= [ 0x02 ] 2
                            Logical
            Item(Local ): Usage Minimum, data= [ 0x01 ] 1
                            Alphanumeric Display
            Item(Local ): Usage Maximum, data= [ 0x66 ] 102
                            (null)
            Item(Global): Logical Minimum, data= [ 0x00 ] 0
            Item(Global): Logical Maximum, data= [ 0x01 ] 1
            Item(Global): Report ID, data= [ 0x02 ] 2
            Item(Global): Report Size, data= [ 0x08 ] 8
            Item(Global): Report Count, data= [ 0x0b ] 11
            Item(Local ): Usage, data= [ 0x2c ] 44
                            Display Data
            Item(Main  ): Output, data= [ 0x02 ] 2
                            Data Variable Absolute No_Wrap Linear
                            Preferred_State No_Null_Position Non_Volatile Bitfield
            Item(Main  ): End Collection, data=none
            Item(Main  ): End Collection, data=none
      Endpoint Descriptor:
        bLength                 7
        bDescriptorType         5
        bEndpointAddress     0x81  EP 1 IN
        bmAttributes            3
          Transfer Type            Interrupt
          Synch Type               None
          Usage Type               Data
        wMaxPacketSize     0x000a  1x 10 bytes
        bInterval              10
Device Status:     0x0000
  (Bus Powered)


***********************************************************
********************** Alienware 15 ***********************
***********************************************************
*** By TrollSid & megaorange ***

DEVICE ID 187c:0528 on Bus 003 Address 003 =================
 bLength                :   0x12 (18 bytes)
 bDescriptorType        :    0x1 Device
 bcdUSB                 :    0x2 USB 0.02
 bDeviceClass           :    0x0 Specified at interface
 bDeviceSubClass        :    0x0
 bDeviceProtocol        :    0x0
 bMaxPacketSize0        :   0x40 (64 bytes)
 idVendor               : 0x187c
 idProduct              : 0x0528
 bcdDevice              :    0x0 Device 0.0
 iManufacturer          :    0x1 Alienware
 iProduct               :    0x2 AW1517
 iSerialNumber          :    0x3 15.0
 bNumConfigurations     :    0x1
  CONFIGURATION 1: 0 mA ====================================
   bLength              :    0x9 (9 bytes)
   bDescriptorType      :    0x2 Configuration
   wTotalLength         :   0x29 (41 bytes)
   bNumInterfaces       :    0x1
   bConfigurationValue  :    0x1
   iConfiguration       :    0x0 
   bmAttributes         :   0xe0 Self Powered, Remote Wakeup
   bMaxPower            :    0x0 (0 mA)
    INTERFACE 0: Human Interface Device ====================
     bLength            :    0x9 (9 bytes)
     bDescriptorType    :    0x4 Interface
     bInterfaceNumber   :    0x0
     bAlternateSetting  :    0x0
     bNumEndpoints      :    0x1
     bInterfaceClass    :    0x3 Human Interface Device
     bInterfaceSubClass :    0x0
     bInterfaceProtocol :    0x0
     iInterface         :    0x0 
      ENDPOINT 0x81: Interrupt IN ==========================
       bLength          :    0x7 (7 bytes)
       bDescriptorType  :    0x5 Endpoint
       bEndpointAddress :   0x81 IN
       bmAttributes     :    0x3 Interrupt
       wMaxPacketSize   :    0xa (10 bytes)
       bInterval        :    0xa


***********************************************************
****************** Alienware 15 R3 ************************
***********************************************************
*** By FarrokhNaj & Heerkaas: ***

Device: ID 187c:0530 Alienware Corporation 
Device Descriptor:
  bLength                18
  bDescriptorType         1
  bcdUSB               0.02
  bDeviceClass            0 (Defined at Interface level)
  bDeviceSubClass         0 
  bDeviceProtocol         0 
  bMaxPacketSize0        64
  idVendor           0x187c Alienware Corporation
  idProduct          0x0530 
  bcdDevice            0.00
  iManufacturer           1 Alienware
  iProduct                2 AW1517
  iSerial                 3 02.90
  bNumConfigurations      1
  Configuration Descriptor:
    bLength                 9
    bDescriptorType         2
    wTotalLength           41
    bNumInterfaces          1
    bConfigurationValue     1
    iConfiguration          0 
    bmAttributes         0xe0
      Self Powered
      Remote Wakeup
    MaxPower                0mA
    Interface Descriptor:
      bLength                 9
      bDescriptorType         4
      bInterfaceNumber        0
      bAlternateSetting       0
      bNumEndpoints           1
      bInterfaceClass         3 Human Interface Device
      bInterfaceSubClass      0 No Subclass
      bInterfaceProtocol      0 None
      iInterface              0 
        HID Device Descriptor:
          bLength                 9
          bDescriptorType        33
          bcdHID               1.01
          bCountryCode            0 Not supported
          bNumDescriptors         1
          bDescriptorType        34 Report
          wDescriptorLength      56
         Report Descriptors: 
           ** UNAVAILABLE **
      Endpoint Descriptor:
        bLength                 7
        bDescriptorType         5
        bEndpointAddress     0x81  EP 1 IN
        bmAttributes            3
          Transfer Type            Interrupt
          Synch Type               None
          Usage Type               Data
        wMaxPacketSize     0x000a  1x 10 bytes
        bInterval              10
Device Status:     0x0000
  (Bus Powered)

***********************************************************
***********              M14X R1            ***************
***********************************************************
*** By rsm: ***

DEVICE ID 187c:0521 on Bus 003 Address 004 =================
 bLength                :   0x12 (18 bytes)
 bDescriptorType        :    0x1 Device
 bcdUSB                 :  0x110 USB 1.1
 bDeviceClass           :    0x0 Specified at interface
 bDeviceSubClass        :    0x0
 bDeviceProtocol        :    0x0
 bMaxPacketSize0        :   0x40 (64 bytes)
 idVendor               : 0x187c
 idProduct              : 0x0521
 bcdDevice              :    0x0 Device 0.0
 iManufacturer          :    0x1 Alienware
 iProduct               :    0x2 M14x
 iSerialNumber          :    0x3 1.0.8
 bNumConfigurations     :    0x1
  CONFIGURATION 1: 64 mA ===================================
   bLength              :    0x9 (9 bytes)
   bDescriptorType      :    0x2 Configuration
   wTotalLength         :   0x29 (41 bytes)
   bNumInterfaces       :    0x1
   bConfigurationValue  :    0x1
   iConfiguration       :    0x0 
   bmAttributes         :   0x80 Bus Powered
   bMaxPower            :   0x20 (64 mA)
    INTERFACE 0: Human Interface Device ====================
     bLength            :    0x9 (9 bytes)
     bDescriptorType    :    0x4 Interface
     bInterfaceNumber   :    0x0
     bAlternateSetting  :    0x0
     bNumEndpoints      :    0x1
     bInterfaceClass    :    0x3 Human Interface Device
     bInterfaceSubClass :    0x0
     bInterfaceProtocol :    0x0
     iInterface         :    0x0 
      ENDPOINT 0x81: Interrupt IN ==========================
       bLength          :    0x7 (7 bytes)
       bDescriptorType  :    0x5 Endpoint
       bEndpointAddress :   0x81 IN
       bmAttributes     :    0x3 Interrupt
       wMaxPacketSize   :    0xa (10 bytes)
       bInterval        :    0xa


***********************************************************
***********              M14X R2            ***************
***********************************************************
*** By jisoriano26: ***

DEVICE ID 187c:0521 on Bus 002 Address 004 =================
  bLength                :   0x12 (18 bytes)
  bDescriptorType        :    0x1 Device
  bcdUSB                 :  0x110 USB 1.1
  bDeviceClass           :    0x0 Specified at interface
  bDeviceSubClass        :    0x0
  bDeviceProtocol        :    0x0
  bMaxPacketSize0        :   0x40 (64 bytes)
  idVendor               : 0x187c
  idProduct              : 0x0521
  bcdDevice              :    0x0 Device 0.0
  iManufacturer          :    0x1 Alienware Gaming
  iProduct               :    0x2 M14x
  iSerialNumber          :    0x3 1.0.6
  bNumConfigurations     :    0x1
   CONFIGURATION 1: 64 mA ===================================
    bLength              :    0x9 (9 bytes)
    bDescriptorType      :    0x2 Configuration
    wTotalLength         :   0x29 (41 bytes)
    bNumInterfaces       :    0x1
    bConfigurationValue  :    0x1
    iConfiguration       :    0x0
    bmAttributes         :   0x80 Bus Powered
    bMaxPower            :   0x20 (64 mA)
     INTERFACE 0: Human Interface Device ====================
      bLength            :    0x9 (9 bytes)
      bDescriptorType    :    0x4 Interface
      bInterfaceNumber   :    0x0
      bAlternateSetting  :    0x0
      bNumEndpoints      :    0x1
      bInterfaceClass    :    0x3 Human Interface Device
      bInterfaceSubClass :    0x0
      bInterfaceProtocol :    0x0
      iInterface         :    0x0
       ENDPOINT 0x81: Interrupt IN ==========================
        bLength          :    0x7 (7 bytes)
        bDescriptorType  :    0x5 Endpoint
        bEndpointAddress :   0x81 IN
        bmAttributes     :    0x3 Interrupt
        wMaxPacketSize   :    0xa (10 bytes)
        bInterval        :    0xa


***********************************************************
*******            M14X R3 (probably)       ***************
***********************************************************
*** By nshp: ***

Bus 004 Device 003: ID 187c:0525 Alienware Corporation 
Couldn't open device, some information will be missing
Device Descriptor:
  bLength                18
  bDescriptorType         1
  bcdUSB               0.02
  bDeviceClass            0 
  bDeviceSubClass         0 
  bDeviceProtocol         0 
  bMaxPacketSize0        64
  idVendor           0x187c Alienware Corporation
  idProduct          0x0525 
  bcdDevice            0.00
  iManufacturer           1 
  iProduct                2 
  iSerial                 3 
  bNumConfigurations      1
  Configuration Descriptor:
    bLength                 9
    bDescriptorType         2
    wTotalLength           41
    bNumInterfaces          1
    bConfigurationValue     1
    iConfiguration          0 
    bmAttributes         0xe0
      Self Powered
      Remote Wakeup
    MaxPower                0mA
    Interface Descriptor:
      bLength                 9
      bDescriptorType         4
      bInterfaceNumber        0
      bAlternateSetting       0
      bNumEndpoints           1
      bInterfaceClass         3 Human Interface Device
      bInterfaceSubClass      0 
      bInterfaceProtocol      0 
      iInterface              0 
        HID Device Descriptor:
          bLength                 9
          bDescriptorType        33
          bcdHID               1.01
          bCountryCode            0 Not supported
          bNumDescriptors         1
          bDescriptorType        34 Report
          wDescriptorLength      56
         Report Descriptors: 
           ** UNAVAILABLE **
      Endpoint Descriptor:
        bLength                 7
        bDescriptorType         5
        bEndpointAddress     0x81  EP 1 IN
        bmAttributes            3
          Transfer Type            Interrupt
          Synch Type               None
          Usage Type               Data
        wMaxPacketSize     0x000a  1x 10 bytes
        bInterval              10


***********************************************************
********************** Alienware M17X *********************
***********************************************************
** By Oleg **

DEVICE ID 187c:0524 on Bus 004 Address 004 =================
 bLength                :   0x12 (18 bytes)
 bDescriptorType        :    0x1 Device
 bcdUSB                 :    0x2 USB 0.02
 bDeviceClass           :    0x0 Specified at interface
 bDeviceSubClass        :    0x0
 bDeviceProtocol        :    0x0
 bMaxPacketSize0        :   0x40 (64 bytes)
 idVendor               : 0x187c
 idProduct              : 0x0524
 bcdDevice              :    0x0 Device 0.0
 iManufacturer          :    0x1 Alienware
 iProduct               :    0x2 M17x
 iSerialNumber          :    0x3 2.3.0
 bNumConfigurations     :    0x1
  CONFIGURATION 1: 0 mA ====================================
   bLength              :    0x9 (9 bytes)
   bDescriptorType      :    0x2 Configuration
   wTotalLength         :   0x29 (41 bytes)
   bNumInterfaces       :    0x1
   bConfigurationValue  :    0x1
   iConfiguration       :    0x0 
   bmAttributes         :   0xc0 Self Powered
   bMaxPower            :    0x0 (0 mA)
    INTERFACE 0: Human Interface Device ====================
     bLength            :    0x9 (9 bytes)
     bDescriptorType    :    0x4 Interface
     bInterfaceNumber   :    0x0
     bAlternateSetting  :    0x0
     bNumEndpoints      :    0x1
     bInterfaceClass    :    0x3 Human Interface Device
     bInterfaceSubClass :    0x0
     bInterfaceProtocol :    0x0
     iInterface         :    0x0 
      ENDPOINT 0x81: Interrupt IN ==========================
       bLength          :    0x7 (7 bytes)
       bDescriptorType  :    0x5 Endpoint
       bEndpointAddress :   0x81 IN
       bmAttributes     :    0x3 Interrupt
       wMaxPacketSize   :    0xa (10 bytes)
       bInterval        :    0xa


***********************************************************
******************* Alienware M17X R2 *********************
***********************************************************

DEVICE ID 187c:0512 on Bus 002 Address 004 =================
 bLength                :   0x12 (18 bytes)
 bDescriptorType        :    0x1 Device
 bcdUSB                 :  0x110 USB 1.1
 bDeviceClass           :    0x0 Specified at interface
 bDeviceSubClass        :    0x0
 bDeviceProtocol        :    0x0
 bMaxPacketSize0        :   0x40 (64 bytes)
 idVendor               : 0x187c
 idProduct              : 0x0512
 bcdDevice              :    0x0 Device 0.0
 iManufacturer          :    0x1 Alienware Gaming
 iProduct               :    0x2 Mobiles
 iSerialNumber          :    0x3 1.1.3
 bNumConfigurations     :    0x1
  CONFIGURATION 1: 64 mA ===================================
   bLength              :    0x9 (9 bytes)
   bDescriptorType      :    0x2 Configuration
   wTotalLength         :   0x29 (41 bytes)
   bNumInterfaces       :    0x1
   bConfigurationValue  :    0x1
   iConfiguration       :    0x0 
   bmAttributes         :   0x80 Bus Powered
   bMaxPower            :   0x20 (64 mA)
    INTERFACE 0: Human Interface Device ====================
     bLength            :    0x9 (9 bytes)
     bDescriptorType    :    0x4 Interface
     bInterfaceNumber   :    0x0
     bAlternateSetting  :    0x0
     bNumEndpoints      :    0x1
     bInterfaceClass    :    0x3 Human Interface Device
     bInterfaceSubClass :    0x0
     bInterfaceProtocol :    0x0
     iInterface         :    0x0 
      ENDPOINT 0x81: Interrupt IN ==========================
       bLength          :    0x7 (7 bytes)
       bDescriptorType  :    0x5 Endpoint
       bEndpointAddress :   0x81 IN
       bmAttributes     :    0x3 Interrupt
       wMaxPacketSize   :    0xa (10 bytes)
       bInterval        :    0xa

***********************************************************
**************** Alienware 17 R2 2015 *********************
***********************************************************
** By Zhen **

DEVICE ID 187c:0528 on Bus 003 Address 003 =================
 bLength                :   0x12 (18 bytes)
 bDescriptorType        :    0x1 Device
 bcdUSB                 :    0x2 USB 0.02
 bDeviceClass           :    0x0 Specified at interface
 bDeviceSubClass        :    0x0
 bDeviceProtocol        :    0x0
 bMaxPacketSize0        :   0x40 (64 bytes)
 idVendor               : 0x187c
 idProduct              : 0x0528
 bcdDevice              :    0x0 Device 0.0
 iManufacturer          :    0x1 Alienware
 iProduct               :    0x2 AW1517
 iSerialNumber          :    0x3 16.0
 bNumConfigurations     :    0x1
  CONFIGURATION 1: 0 mA ====================================
   bLength              :    0x9 (9 bytes)
   bDescriptorType      :    0x2 Configuration
   wTotalLength         :   0x29 (41 bytes)
   bNumInterfaces       :    0x1
   bConfigurationValue  :    0x1
   iConfiguration       :    0x0 
   bmAttributes         :   0xe0 Self Powered, Remote Wakeup
   bMaxPower            :    0x0 (0 mA)
    INTERFACE 0: Human Interface Device ====================
     bLength            :    0x9 (9 bytes)
     bDescriptorType    :    0x4 Interface
     bInterfaceNumber   :    0x0
     bAlternateSetting  :    0x0
     bNumEndpoints      :    0x1
     bInterfaceClass    :    0x3 Human Interface Device
     bInterfaceSubClass :    0x0
     bInterfaceProtocol :    0x0
     iInterface         :    0x0 
      ENDPOINT 0x81: Interrupt IN ==========================
       bLength          :    0x7 (7 bytes)
       bDescriptorType  :    0x5 Endpoint
       bEndpointAddress :   0x81 IN
       bmAttributes     :    0x3 Interrupt
       wMaxPacketSize   :    0xa (10 bytes)
       bInterval        :    0xa
