
***********************************************************
****************** Alienware 15 R4 ************************
***********************************************************

# By @AbsyntheSyne https://github.com/AbsyntheSyne
# https://github.com/rsm-gh/akbl/issues/52

DEVICE ID 187c:0550 on Bus 001 Address 003 =================
 bLength                :   0x12 (18 bytes)
 bDescriptorType        :    0x1 Device
 bcdUSB                 :  0x200 USB 2.0
 bDeviceClass           :    0x0 Specified at interface
 bDeviceSubClass        :    0x0
 bDeviceProtocol        :    0x0
 bMaxPacketSize0        :   0x40 (64 bytes)
 idVendor               : 0x187c
 idProduct              : 0x0550
 bcdDevice              :  0x200 Device 2.0
 iManufacturer          :    0x1 Alienware
 iProduct               :    0x2 AW-ELC
 iSerialNumber          :    0x3 00.01
 bNumConfigurations     :    0x1
  CONFIGURATION 1: 0 mA ====================================
   bLength              :    0x9 (9 bytes)
   bDescriptorType      :    0x2 Configuration
   wTotalLength         :   0x29 (41 bytes)
   bNumInterfaces       :    0x1
   bConfigurationValue  :    0x1
   iConfiguration       :    0x0 
   bmAttributes         :   0xe0 Self Powered, Remote Wakeup
   bMaxPower            :    0x0 (0 mA)
    INTERFACE 0: Human Interface Device ====================
     bLength            :    0x9 (9 bytes)
     bDescriptorType    :    0x4 Interface
     bInterfaceNumber   :    0x0
     bAlternateSetting  :    0x0
     bNumEndpoints      :    0x2
     bInterfaceClass    :    0x3 Human Interface Device
     bInterfaceSubClass :    0x0
     bInterfaceProtocol :    0x0
     iInterface         :    0x0 
      ENDPOINT 0x81: Interrupt IN ==========================
       bLength          :    0x7 (7 bytes)
       bDescriptorType  :    0x5 Endpoint
       bEndpointAddress :   0x81 IN
       bmAttributes     :    0x3 Interrupt
       wMaxPacketSize   :   0x21 (33 bytes)
       bInterval        :    0xa
      ENDPOINT 0x1: Interrupt OUT ==========================
       bLength          :    0x7 (7 bytes)
       bDescriptorType  :    0x5 Endpoint
       bEndpointAddress :    0x1 OUT
       bmAttributes     :    0x3 Interrupt
       wMaxPacketSize   :   0x21 (33 bytes)
       bInterval        :   0x64
