
***********************************************************
********************        Area51 R1       ***************
***********************************************************
#By: 	https://github.com/kylrth
#Issue: https://github.com/rsm-gh/akbl/issues/100

$ sudo lsusb -D /dev/bus/usb/003/003
Device: ID 187c:0526 Alienware Corporation 
Device Descriptor:
  bLength                18
  bDescriptorType         1
  bcdUSB               0.02
  bDeviceClass            0 
  bDeviceSubClass         0 
  bDeviceProtocol         0 
  bMaxPacketSize0        64
  idVendor           0x187c Alienware Corporation
  idProduct          0x0526 
  bcdDevice            0.00
  iManufacturer           1 Alienware
  iProduct                2 A-51
  iSerial                 3 9.0.0
  bNumConfigurations      1
  Configuration Descriptor:
    bLength                 9
    bDescriptorType         2
    wTotalLength       0x0029
    bNumInterfaces          1
    bConfigurationValue     1
    iConfiguration          0 
    bmAttributes         0xc0
      Self Powered
    MaxPower                0mA
    Interface Descriptor:
      bLength                 9
      bDescriptorType         4
      bInterfaceNumber        0
      bAlternateSetting       0
      bNumEndpoints           1
      bInterfaceClass         3 Human Interface Device
      bInterfaceSubClass      0 
      bInterfaceProtocol      0 
      iInterface              0 
        HID Device Descriptor:
          bLength                 9
          bDescriptorType        33
          bcdHID               1.01
          bCountryCode            0 Not supported
          bNumDescriptors         1
          bDescriptorType        34 Report
          wDescriptorLength      56
         Report Descriptors: 
           ** UNAVAILABLE **
      Endpoint Descriptor:
        bLength                 7
        bDescriptorType         5
        bEndpointAddress     0x81  EP 1 IN
        bmAttributes            3
          Transfer Type            Interrupt
          Synch Type               None
          Usage Type               Data
        wMaxPacketSize     0x000a  1x 10 bytes
        bInterval              10
can't get debug descriptor: Resource temporarily unavailable
Device Status:     0x0000
  (Bus Powered)
